{
  "outputDir": "reports/backtesting/test-smoke",
  "transactionCosts": {
    "spreadPips": 0.5,
    "slippagePips": 0.1,
    "commissionPerLot": 5,
    "lotSize": 100000
  },
  "backtesterOptions": {
    "entryOffset": 1,
    "defaultHoldBars": 6,
    "defaultTakeProfitPips": 10,
    "defaultStopLossPips": 8,
    "units": 10000
  },
  "monteCarlo": {
    "enabled": false
  },
  "walkForward": {
    "enabled": false
  },
  "datasets": [
    {
      "label": "Smoke EURUSD M15",
      "pair": "EURUSD",
      "timeframe": "M15",
      "priceFile": {
        "path": "data/backtests/eurusd-m15-bars.json",
        "format": "json"
      },
      "signalFile": {
        "path": "data/backtests/eurusd-m15-signals.json",
        "format": "json"
      }
    }
  ]
}
